{
  "artifactId": "CONNECT-D02-A9-EXTERNAL-ATOMIC-PACKAGE-ENVELOPE-2026-08-30",
  "envelopeVersion": "1.0.0",
  "namespaceRoot": "web",
  "logicalPackageRoot": "docs/planning/d02-a9-openai-responses-data-control-eval-tool-safety-package-2026-08-30/",
  "selfMembership": "EXCLUDED-NON-SELF-REFERENTIAL",
  "memberCount": 83,
  "memberOrder": [
    "docs/decision-intake-2026-08-21.md",
    "docs/planning/d02-a4-openai-model-routing-reconciliation-2026-08-29.md",
    "docs/planning/d02-a5-openai-responses-data-control-and-model-selection-reconciliation-2026-08-29.md",
    "docs/planning/d02-a6-openai-responses-data-control-eval-and-tool-safety-reconciliation-2026-08-30.md",
    "docs/planning/d02-a6-openai-responses-data-control-eval-and-tool-safety-reconciliation-independent-hostile-review-2026-08-30.md",
    "docs/planning/d02-a6-openai-responses-data-control-eval-and-tool-safety-reconciliation-independent-hostile-review-findings-manifest-2026-08-30.md",
    "docs/planning/d02-a7-openai-responses-data-control-eval-and-tool-safety-finding-closure-crosswalk-2026-08-30.md",
    "docs/planning/d02-a7-openai-responses-data-control-eval-and-tool-safety-independent-hostile-review-2026-08-30.md",
    "docs/planning/d02-a7-openai-responses-data-control-eval-and-tool-safety-independent-hostile-review-findings-manifest-2026-08-30.md",
    "docs/planning/d02-a7-openai-responses-data-control-eval-and-tool-safety-producer-qa-2026-08-30.md",
    "docs/planning/d02-a7-openai-responses-data-control-eval-and-tool-safety-semantic-successor-2026-08-30.md",
    "docs/planning/d02-a8-openai-responses-data-control-eval-and-tool-safety-finding-closure-crosswalk-2026-08-30.md",
    "docs/planning/d02-a8-openai-responses-data-control-eval-and-tool-safety-immutable-successor-2026-08-30.md",
    "docs/planning/d02-a8-openai-responses-data-control-eval-and-tool-safety-independent-hostile-review-2026-08-30.md",
    "docs/planning/d02-a8-openai-responses-data-control-eval-and-tool-safety-independent-hostile-review-findings-manifest-2026-08-30.md",
    "docs/planning/d02-a8-openai-responses-data-control-eval-and-tool-safety-producer-qa-2026-08-30.md",
    "docs/planning/d02-a8-openai-responses-data-control-eval-tool-safety-package-2026-08-30/dependency-dag.json",
    "docs/planning/d02-a8-openai-responses-data-control-eval-tool-safety-package-2026-08-30/mutation-corpus.json",
    "docs/planning/d02-a8-openai-responses-data-control-eval-tool-safety-package-2026-08-30/mutation-oracle.json",
    "docs/planning/d02-a8-openai-responses-data-control-eval-tool-safety-package-2026-08-30/package-manifest.json",
    "docs/planning/d02-a8-openai-responses-data-control-eval-tool-safety-package-2026-08-30/reader-a-report.json",
    "docs/planning/d02-a8-openai-responses-data-control-eval-tool-safety-package-2026-08-30/reader-a.mjs",
    "docs/planning/d02-a8-openai-responses-data-control-eval-tool-safety-package-2026-08-30/reader-b-report.json",
    "docs/planning/d02-a8-openai-responses-data-control-eval-tool-safety-package-2026-08-30/reader-b.rb",
    "docs/planning/d02-a8-openai-responses-data-control-eval-tool-safety-package-2026-08-30/registry.json",
    "docs/planning/d02-a8-openai-responses-data-control-eval-tool-safety-package-2026-08-30/root-instances.json",
    "docs/planning/d02-a8-openai-responses-data-control-eval-tool-safety-package-2026-08-30/schema.json",
    "docs/planning/d02-a9-openai-responses-data-control-eval-and-tool-safety-finding-closure-crosswalk-2026-08-30.md",
    "docs/planning/d02-a9-openai-responses-data-control-eval-and-tool-safety-immutable-successor-2026-08-30.md",
    "docs/planning/d02-a9-openai-responses-data-control-eval-and-tool-safety-producer-qa-2026-08-30.md",
    "docs/planning/d02-a9-openai-responses-data-control-eval-tool-safety-package-2026-08-30/admitted-input-manifest.json",
    "docs/planning/d02-a9-openai-responses-data-control-eval-tool-safety-package-2026-08-30/control-oracle.json",
    "docs/planning/d02-a9-openai-responses-data-control-eval-tool-safety-package-2026-08-30/dependency-dag.json",
    "docs/planning/d02-a9-openai-responses-data-control-eval-tool-safety-package-2026-08-30/envelope.schema.json",
    "docs/planning/d02-a9-openai-responses-data-control-eval-tool-safety-package-2026-08-30/execution-receipts.json",
    "docs/planning/d02-a9-openai-responses-data-control-eval-tool-safety-package-2026-08-30/generate.mjs",
    "docs/planning/d02-a9-openai-responses-data-control-eval-tool-safety-package-2026-08-30/generation-report.json",
    "docs/planning/d02-a9-openai-responses-data-control-eval-tool-safety-package-2026-08-30/mutation-corpus.json",
    "docs/planning/d02-a9-openai-responses-data-control-eval-tool-safety-package-2026-08-30/mutation-oracle.json",
    "docs/planning/d02-a9-openai-responses-data-control-eval-tool-safety-package-2026-08-30/positive-controls.json",
    "docs/planning/d02-a9-openai-responses-data-control-eval-tool-safety-package-2026-08-30/predecessor-semantic-universe.json",
    "docs/planning/d02-a9-openai-responses-data-control-eval-tool-safety-package-2026-08-30/producer-appointments.json",
    "docs/planning/d02-a9-openai-responses-data-control-eval-tool-safety-package-2026-08-30/reader-a-report.json",
    "docs/planning/d02-a9-openai-responses-data-control-eval-tool-safety-package-2026-08-30/reader-a.mjs",
    "docs/planning/d02-a9-openai-responses-data-control-eval-tool-safety-package-2026-08-30/reader-b-report.json",
    "docs/planning/d02-a9-openai-responses-data-control-eval-tool-safety-package-2026-08-30/reader-b.rb",
    "docs/planning/d02-a9-openai-responses-data-control-eval-tool-safety-package-2026-08-30/semantic-registry.json",
    "docs/planning/d02-a9-openai-responses-data-control-eval-tool-safety-package-2026-08-30/semantic-shards/semantic-shard-001.json",
    "docs/planning/d02-a9-openai-responses-data-control-eval-tool-safety-package-2026-08-30/semantic-shards/semantic-shard-002.json",
    "docs/planning/d02-a9-openai-responses-data-control-eval-tool-safety-package-2026-08-30/semantic-shards/semantic-shard-003.json",
    "docs/planning/d02-a9-openai-responses-data-control-eval-tool-safety-package-2026-08-30/semantic-shards/semantic-shard-004.json",
    "docs/planning/d02-a9-openai-responses-data-control-eval-tool-safety-package-2026-08-30/semantic-shards/semantic-shard-005.json",
    "docs/planning/d02-a9-openai-responses-data-control-eval-tool-safety-package-2026-08-30/semantic-shards/semantic-shard-006.json",
    "docs/planning/d02-a9-openai-responses-data-control-eval-tool-safety-package-2026-08-30/semantic-shards/semantic-shard-007.json",
    "docs/planning/d02-a9-openai-responses-data-control-eval-tool-safety-package-2026-08-30/semantic-shards/semantic-shard-008.json",
    "docs/planning/d02-a9-openai-responses-data-control-eval-tool-safety-package-2026-08-30/semantic-shards/semantic-shard-009.json",
    "docs/planning/d02-a9-openai-responses-data-control-eval-tool-safety-package-2026-08-30/semantic-shards/semantic-shard-010.json",
    "docs/planning/d02-a9-openai-responses-data-control-eval-tool-safety-package-2026-08-30/semantic-shards/semantic-shard-011.json",
    "docs/planning/d02-a9-openai-responses-data-control-eval-tool-safety-package-2026-08-30/semantic-shards/semantic-shard-012.json",
    "docs/planning/d02-a9-openai-responses-data-control-eval-tool-safety-package-2026-08-30/semantic-shards/semantic-shard-013.json",
    "docs/planning/d02-a9-openai-responses-data-control-eval-tool-safety-package-2026-08-30/semantic-shards/semantic-shard-014.json",
    "docs/planning/d02-a9-openai-responses-data-control-eval-tool-safety-package-2026-08-30/semantic-shards/semantic-shard-015.json",
    "docs/planning/d02-a9-openai-responses-data-control-eval-tool-safety-package-2026-08-30/semantic-shards/semantic-shard-016.json",
    "docs/planning/d02-a9-openai-responses-data-control-eval-tool-safety-package-2026-08-30/semantic-shards/semantic-shard-017.json",
    "docs/planning/d02-a9-openai-responses-data-control-eval-tool-safety-package-2026-08-30/semantic-shards/semantic-shard-018.json",
    "docs/planning/d02-a9-openai-responses-data-control-eval-tool-safety-package-2026-08-30/semantic-shards/semantic-shard-019.json",
    "docs/planning/d02-a9-openai-responses-data-control-eval-tool-safety-package-2026-08-30/semantic-shards/semantic-shard-020.json",
    "docs/planning/d02-a9-openai-responses-data-control-eval-tool-safety-package-2026-08-30/semantic-shards/semantic-shard-021.json",
    "docs/planning/d02-a9-openai-responses-data-control-eval-tool-safety-package-2026-08-30/semantic-shards/semantic-shard-022.json",
    "docs/planning/d02-a9-openai-responses-data-control-eval-tool-safety-package-2026-08-30/semantic-shards/semantic-shard-023.json",
    "docs/planning/d02-a9-openai-responses-data-control-eval-tool-safety-package-2026-08-30/semantic-shards/semantic-shard-024.json",
    "docs/planning/d02-a9-openai-responses-data-control-eval-tool-safety-package-2026-08-30/semantic-shards/semantic-shard-025.json",
    "docs/planning/d02-a9-openai-responses-data-control-eval-tool-safety-package-2026-08-30/semantic-shards/semantic-shard-026.json",
    "docs/planning/d02-a9-openai-responses-data-control-eval-tool-safety-package-2026-08-30/semantic-shards/semantic-shard-027.json",
    "docs/planning/d02-a9-openai-responses-data-control-eval-tool-safety-package-2026-08-30/semantic-shards/semantic-shard-028.json",
    "docs/planning/d02-a9-openai-responses-data-control-eval-tool-safety-package-2026-08-30/semantic-shards/semantic-shard-029.json",
    "docs/planning/d02-a9-openai-responses-data-control-eval-tool-safety-package-2026-08-30/snapshot.json",
    "docs/planning/d02-a9-openai-responses-data-control-eval-tool-safety-package-2026-08-30/snapshot.schema.json",
    "docs/planning/d02-a9-openai-responses-data-control-eval-tool-safety-package-2026-08-30/source-receipts.json",